{
  "schema_version": "1.0.0",
  "id": "effectiveness-report.docara-repo-local-effectiveness-20260529",
  "operation_id": "mirai_graph.effectiveness-report",
  "created_at": "2026-05-29T19:59:12.693991+00:00",
  "target_ref": "skill:docara",
  "target_type": "skill",
  "owner_skill": "docara",
  "reviewer": "graph",
  "baseline_refs": [
    "skills/docara/SKILL.md"
  ],
  "mirai_graph_refs": [
    "graph/generated/control-dashboards/docara-repo-local-control-dashboard-20260529/control-dashboard.json"
  ],
  "scenario_results": [
    {
      "scenario_id": "delivery-routing",
      "summary": "Mirai Graph exposes delivery/support boundaries and next gates for docara tasks",
      "baseline_score": 64,
      "mirai_graph_score": 82,
      "delta": 18,
      "verdict": "improved",
      "evidence_refs": [
        "graph/generated/control-dashboards/docara-repo-local-control-dashboard-20260529/control-dashboard.json"
      ]
    },
    {
      "scenario_id": "handoff-readiness",
      "summary": "Graph companion layer keeps handoff and artifact expectations visible",
      "baseline_score": 65,
      "mirai_graph_score": 81,
      "delta": 16,
      "verdict": "improved",
      "evidence_refs": [
        "graph/generated/mirai-graph/semantic-preservation/docara-repo-local-semantic-review-20260529/semantic-preservation-verdict.json"
      ]
    },
    {
      "scenario_id": "federation-contract",
      "summary": "Federation export can carry bounded docara context without copying domain playbooks",
      "baseline_score": 58,
      "mirai_graph_score": 80,
      "delta": 22,
      "verdict": "improved",
      "evidence_refs": [
        "graph/generated/seed-expansions/docara-repo-local-seed-expand-20260529/graph-embryo.json"
      ]
    }
  ],
  "metrics_summary": {
    "scenario_count": 3,
    "minimum_required_scenarios": 3,
    "average_baseline_score": 62.3,
    "average_mirai_graph_score": 81.0,
    "average_delta": 18.7,
    "verdict_counts": {
      "improved": 3
    }
  },
  "verdict": "improved",
  "effectiveness_allowed": true,
  "blockers": [],
  "next_actions": [
    "run mirai-graph-adoption-report with effectiveness ref",
    "do not claim federation readiness until semantic and effectiveness gates pass"
  ],
  "canonical_write_allowed": false
}
